{
  "contract_name": "supervisor.approval.preview",
  "contract_version": "1.0.0",
  "schema_version": "1.0.0",
  "taxonomy_version": "taxonomy-reason-v1",
  "tenant_id": "tenant-lab-001",
  "customer_context_id": "customer-context-main",
  "environment": "phase0_lab",
  "correlation_id": "corr-approval-preview-001",
  "causation_id": "task-proposal-001",
  "idempotency_key": "idem-approval-preview-001-r1",
  "producer": {"component": "supervisor", "produced_at": "2026-09-07T18:00:00Z"},
  "policy_version": "policy-supervisor-approval-preview-lab-v1",
  "approval_preview_id": "approval-preview-001",
  "revision": 1,
  "source_proposal_id": "task-proposal-001",
  "source_proposal_revision": 4,
  "source_proposal_state": "accepted_for_future_approval",
  "source_proposal_hash": "sha256:e745be5de41c68fbe7c67ee4ac5afce678aaef64ef482192865cefd22b575c3a",
  "state": "preview_ready",
  "transition_reason_codes": ["approval_preview_created"],
  "review_outcome": "pending",
  "preview_scope": {
    "requested_action_class": "form_preparation_review",
    "external_effect": "none",
    "resource_refs": ["task-proposal-001"],
    "allowed_operations": ["review_prepared_form_plan"],
    "prohibited_operations": ["create_real_approval_request", "issue_approval_token", "create_approval_binding", "assign_worker", "dispatch_arc", "model_call", "tool_use", "connector_access", "form_submission", "external_effect"],
    "data_classification": "synthetic_fixture_only",
    "risk_tier": "low",
    "scope_hash": "sha256:92f7996dd929a11901fe5cc219b338650e2a470f805f85c1e4321a7c1b77f961",
    "max_uses": 0
  },
  "approver_requirements": {
    "approver_roles": ["business_owner"],
    "identity_binding_required": true,
    "identity_binding_status": "not_bound_in_preview",
    "fresh_intent_required": true,
    "separation_of_duties_review_required": true
  },
  "future_request_policy": {
    "guardian_recheck_required": true,
    "proposal_revision_recheck_required": true,
    "single_use_token_required_if_later_approved": true,
    "suggested_request_ttl_seconds": 900,
    "silent_promotion_allowed": false
  },
  "guardian_decision_id": "gd-approval-preview-001",
  "pre_action_evidence_ref": "harness-event:approval-preview-pre-001",
  "post_action_evidence_ref": "harness-event:approval-preview-post-001",
  "synthetic_data_only": true,
  "free_form_content_allowed": false,
  "real_approval_request_created": false,
  "approval_result_created": false,
  "approval_token_issued": false,
  "approval_binding_created": false,
  "token_verification_performed": false,
  "replay_record_created": false,
  "assigned_worker_id": null,
  "arc_dispatch_allowed": false,
  "arc_dispatched": false,
  "model_called": false,
  "tools_used": false,
  "connector_accessed": false,
  "submission_allowed": false,
  "external_side_effects": false,
  "preview_expires_at": "2026-09-07T18:15:00Z",
  "created_at": "2026-09-07T18:00:00Z",
  "updated_at": "2026-09-07T18:00:00Z"
}
